{
  "schema": {
    "major": 1,
    "minor": 0
  },
  "wall_id": "w-living",
  "wall_name": "Living room",
  "display_state": {
    "state": "showing_art",
    "work_id": "work-great-wave",
    "since": "2026-10-08T16:00:00Z"
  },
  "label": {
    "title": "The Great Wave off Kanagawa",
    "artist": "Katsushika Hokusai",
    "artist_family_name": "Katsushika",
    "artist_given_name": "Hokusai",
    "artist_nationality": "Japanese",
    "artist_dates": "1760–1849",
    "date_created": "c. 1830–32",
    "medium": "Woodblock print; ink and color on paper",
    "dimensions": "25.7 × 37.9 cm",
    "commentary": null
  }
}
